{
  "metadata": { "contractVersion": "1.0.0", "ontologyVersion": "1.1.0", "dataVersion": "0.5.0", "traceId": "fixture-value-stream-001", "generatedAt": "2026-07-14T00:00:00Z" },
  "entities": [
    { "id": "operation:op30", "iri": "https://example.com/mkg/demo#OP30", "type": "mfg:Operation", "label": "OP30 Leak Test", "domain": "production", "properties": { "cycleTimeSeconds": 42 }, "status": "active" },
    { "id": "wip:op30", "iri": "https://example.com/mkg/demo#WIPOP30", "type": "mfg:Material", "label": "Tested Booster WIP", "domain": "valueStream", "properties": { "quantity": 20, "waitingTimeMinutes": 8 }, "status": "active" }
  ],
  "relations": [
    { "id": "rel:op30-produces-wip", "sourceId": "operation:op30", "targetId": "wip:op30", "predicate": "mfg:produces", "label": "produces" }
  ],
  "nodes": [
    { "id": "node:op30-vs", "entityId": "operation:op30", "visualType": "process-box", "column": 3, "stackId": "OP30", "viewMetadata": { "x": 1280, "y": 260 } },
    { "id": "node:wip-op30", "entityId": "wip:op30", "visualType": "wip-buffer", "column": 4, "stackId": "VS-WIP-OP30", "viewMetadata": { "x": 1600, "y": 260 } }
  ],
  "edges": [
    { "id": "edge:op30-wip", "relationId": "rel:op30-produces-wip", "source": "node:op30-vs", "target": "node:wip-op30", "label": "produces", "metrics": { "partsQty": 20, "cycleTimeSeconds": 42 }, "viewMetadata": { "waitingTimeMinutes": 8 } }
  ]
}
