{
  "metadata": { "contractVersion": "1.1.0", "ontologyVersion": "1.1.0", "dataVersion": "0.5.0", "traceId": "fixture-quality-001", "generatedAt": "2026-07-14T00:00:00Z" },
  "entities": [
    { "id": "quality:leak-rate", "iri": "https://example.com/mkg/demo#LeakRate", "type": "qual:CriticalCharacteristic", "label": "Leak Rate", "domain": "quality", "properties": { "unit": "sccm", "upperLimit": 5 }, "version": "1", "status": "active" },
    { "id": "operation:op30", "iri": "https://example.com/mkg/demo#OP30", "type": "mfg:Operation", "label": "OP30 Leak Test", "domain": "production", "properties": { "inspectionFrequency": "100%" }, "status": "active" },
    { "id": "control-plan:cp001-v3", "iri": "https://example.com/mkg/demo#CP001V3", "type": "qual:ControlPlanVersion", "label": "Control Plan CP-001 V3", "domain": "quality", "properties": { "inspectionMethod": "automatic leak test" }, "validFrom": "2026-03-15T00:00:00Z", "version": "3", "status": "effective" }
  ],
  "relations": [
    { "id": "rel:op30-controls-leak-rate", "sourceId": "operation:op30", "targetId": "quality:leak-rate", "predicate": "qual:controlsCharacteristic", "label": "controls characteristic" },
    { "id": "rel:cp001v3-controls-leak-rate", "sourceId": "control-plan:cp001-v3", "targetId": "quality:leak-rate", "predicate": "qual:controlsCharacteristic", "label": "controls characteristic" }
  ],
  "nodes": [
    { "id": "node:op30-quality", "entityId": "quality:leak-rate", "visualType": "quality-characteristic", "column": 3, "stackId": "OP30", "isCritical": true, "badges": ["CTQ", "100%"], "viewMetadata": { "x": 1280, "y": 260 } }
  ],
  "edges": []
}
